Municipio,CNES,LOGRADOURO,NOME
ARACAJU,2216,AV AZUL,US OSVALDO LEITE TERRA DURA
ARACAJU,2259,RUA MARUIM,US MARIA DO CEU SANTOS PEREIRA
ARACAJU,2305,R HAITI,US ADEL NUNES BAIRRO AMERICA
ARACAJU,2364,RUA SAO JOAO,US CANDIDA ALVES SANTO ANTONIO
ARACAJU,2380,RUA RENATO FONSECA OLIVEIRA,US HUGO GURGEL COROA DO MEIO
ARACAJU,2399,RUA MARIA DO CARMO COSTA,US MANOEL DE SOUZA PEREIRA SOL NASCENTE
ARACAJU,2410,AVENIDA HERMES FONTES,US DONA SINHAZINHA GRAGERU
ARACAJU,2429,RUA MAJOR AURELIANO,US JOSE MACHADO DE SOUZA SANTOS DUMONT
ARACAJU,2453,RUA FIRMINO FONTES,US ANTONIO ALVES ATALAIA
ARACAJU,2461,AV SAO JOAO BATISTA,US FERNANDO SAMPAIO CASTELO BRANCO
ARACAJU,2542,RUA ALAGOAS,US JOAO CARDOSO NASCIMENTO JUNIOR JOSE CONRADO DE ARAUJO
ARACAJU,2550,RUA B,US ELIZABETE PITA TERRA DURA
ARACAJU,2577,RUA PARAIBA,US EDEZIO VIEIRA DE MELO SIQUEIRA CAMPOS
ARACAJU,2607,RUA ELENITA NERY GOMES,US AUGUSTO CESAR LEITE SANTA TEREZA
ARACAJU,2615,AV TRANCREDO NEVES,US MINISTRO COSTA CAVALVANTE INACIO BARBOSA
ARACAJU,2763,RUA ALTAMIRA,US DONA JOVEM AZEVEDO INDUSTRIAL
ARACAJU,2771,SANTA TEREZINHA,US JOSE QUINTILIANO DA FONSECA SOBRAL CIDADE NOVA
ARACAJU,2798,AV EUCLIDES FIGUEIREDO,US JOSE AUGUSTO BARRETO JAPAOZINHO
ARACAJU,2844,AVENIDA RADIALISTA JOSE DA SILVA LIMA,US ONESIMO PINTO FILHO JARDIM CENTENARIO
ARACAJU,3093,RUA DOS NAUFRAGOS,US NICEU DANTAS MOSQUEIRO
ARACAJU,3123,RUA PRINCIPAL,US IRMA CARIDADE ALOQUE
ARACAJU,3344,RUA ANTONIO DOS SANTOS,US PORTO DANTAS
ARACAJU,3387,RUA CAPITAO MANOEL GOMES,US RENATO MAZZE LUCAS LAMARAO
ARACAJU,3395,AVENIDA CARLOS MARQUES,US CARLOS HARDMAN CORTES SOLEDADE
ARACAJU,3409,RUA SENHOR DO BOMFIM,US JOAO DE OLIVEIRA SOBRAL SANTOS DUMONT
ARACAJU,3425,ROD JOAO ALVES BEZERRA,US JOAO BEZERRA AREIA BRANCA
ARACAJU,3492,TV ADALTO BOTELHO,US OSWALDO DE SOUZA
ARACAJU,3506,AV LAMARAO,US CARLOS FERNANDES DE MELO LAMARAO
ARACAJU,2291,CENTRAL IV,US GERALDO MAGELA DE MENEZES SAO CONRADO
ARACAJU,2445,RUA A,US HUMBERTO MOURAO GUIMARAES SAO CONRADO
ARACAJU,2526,AV ALVARO MARCIEL,US FRANCISCO FONSECA DEZOITO DO FORTE
ARACAJU,2623,RUA B,US WALTER CARDOSO VENEZA
ARACAJU,2836,RUA PROJETADA,US LAURO DANTAS HORA BUGIO
ARACAJU,25674,RUA TENENTE WENDEL QUARANTA,US AMELIA LEITE
ARACAJU,25682,RODOVIA DOS NAUFRAGOS KM 05,US SANTA TEREZINHA ROBALO
ARACAJU,25690,RUA FILEMON FREIRE,US MAX DE CARVALHO ROCHA LUZIA
ITABAIANA,44423,POVOADO VARZEA DO GAMA,UNIDADE BASIC DE SAUDE ANTONIO TELES DE MENDONCA
ITABAIANA,89117,POVOADO TABOCA,UNIDADE BASICA DE SAUDE MARIA JACINTA DOS SANTOS
ARACAJU,3115,RUA O,US AVILA NABUCO MEDICI
FREI PAULO,102822,RUA A,UBS GERALDO DAS NEVES SANTOS
FREI PAULO,102903,RUA PRINCIPAL,UBS JOSEFA BATISTA DE JESUS
NOSSA SENHORA DAS DORES,110132,COLONIA SAPE,UNIDADE BASICA DA SAUDE INES LIMA COSTA
ITABAIANA,2546159,RUA F CONJ JOSE LUIZ CONCEICAO,UNIDADE PSF SAO CRISTOVAO
ITABAIANA,428159,AV EDUARDO PAIXAO ROCHA,UNIDADE BASICA DE SAUDE MARIA MENESES DOS SANTOS
ITAPORANGA D'AJUDA,191892,AVENIDA EMIDIO MAXI NETO,CENTRO DE ATENDIMENTO PARA ENFRENTAMENTO A COVID 19
JAPOATA,193208,RUA JUVENAL MELO,VIGILANCIA EM SAUDE
NOSSA SENHORA DO SOCORRO,199974,TRAVESSA 3 A,US VALTER DE JESUS ROCHA
SAO CRISTOVAO,204331,BR 101,COPEMCAN
CARMOPOLIS,220469,ALTO NOSSA SENHORA DE FATIMA,CENTRO DE ENFRENTAMENTO AO COVID
ESTANCIA,271276,BR 101 KM 147,CADEIA PUBLICA DE ESTANCIA
AREIA BRANCA,271349,RODOVIA BR 235 KM 36,CADEIA PUBLICA DE AREIA BRANCA
TOBIAS BARRETO,272558,RODOVIA ANTONIO CARLOS VALADARES,PRESIDIO REGIONAL JUIZ MANOEL BARBOSA DE SOUZA
BOQUIM,287504,RUA JOAO VIDAL DE CARVALHO,UBS GOV MARCELO DEDA CHAGAS
PEDRINHAS,796158,CONJUNTO BARRETAO,POSTO DE SAUDE MARIA OSMARINA DE SANTANA
PEDRA MOLE,383074,ASSENTAMENTO SAO JOSE DA QUIXABEIRA,UBS ERIDAN CONRADO DOS SANTOS CARVALHO
POCO REDONDO,397733,POVOADO CURRALINHO,USB POVOADO CURRALINHO
ITABAIANINHA,406120,RUA MARECHAL DEODORO DA FONSECA,NUCLEO DE ATENDIMENTO ESPECIALIZADO MUNICIPAL
SAO CRISTOVAO,433799,PAULO BARRETO DE MENEZES,UBS IRONIA MARIA ARAGAO PRADO MEIRELES
NOSSA SENHORA DO SOCORRO,191159,AVENIDA NOVO HORIZONTE,US SUZINETE GOMES DA SILVA DIAS
TELHA,2422964,RUA ANTONIO MOTA,CENTRO DE SAUDE DA FAMILIA DE TELHA
PEDRINHAS,2423375,POVOADO MUTUMBO,U S F DO POVOADO MUTUMBO
PEDRINHAS,2423383,POV BUENOS AIRES,CLINICA DE SAUDE DA FAMILIA ODILON JOSE ALVES
SALGADO,145815,POV ABOBORAS,UBS FRANCISCO MARTINS FONTES
MALHADA DOS BOIS,2423332,RUA DO CLUBE,CLINICA DE SAUDE DA FAMILIA MARIANA DIAS DOS SANTOS BARBOSA
MONTE ALEGRE DE SERGIPE,2420295,POVOADO LAGOA DO ROCADO,UNIDADE DE SAUDE DA FAMILIA DO POVOADO LAGOA DO ROCADO
POCO VERDE,2420384,RUA GABRIEL BENEVIDES DO ROSARIO,APS JOAO ANTONIO DE ABREU
DIVINA PASTORA,2423030,RUA A,UNIDADE BASICA DE SAUDE IRMAO WALTER
MONTE ALEGRE DE SERGIPE,3059170,POVOADO MARAVILHA MONTE ALEGRESE,UNIDADE DE SAUDE DA FAMILIA DO POVOADO MARAVILHA
ITABAIANINHA,2421283,RUA ROZENTINA F COSTA,UNIDADE BASICA DE SAUDE ANA DE FREITAS MUNIZ
FREI PAULO,2423618,RUA JOSE ROSENDO DOS SANTOS,CENTRO DE SAUDE 1
FREI PAULO,2423626,RUA,POSTO DE SAUDE MOCAMBO
CANHOBA,2658550,RODOVIA ERONILDES F DE CARVALHO,CLINICA EDGARD GOMES DE MENEZES
NEOPOLIS,2420058,POVOADO BETUME,E S F BETUME
NEOPOLIS,2420066,POVOADO FLOR DO BREJO,UNIDADE DE SAUDE DA FAMILIA DO POV FLOR DO BREJO
POCO REDONDO,2420082,ASSENTAMENTO ALTO BONITO,UNIDADE DE SAUDE DA FAMILIA ALTO BONITO
POCO REDONDO,2420090,POVOADO SITIOS NOVOS,UNIDADE SAUDE DA FAMILIA POV SITIOS NOVOS
POCO REDONDO,2420104,POVOADO BONSUCESSO,UNIDADE SAUDE DA FAMILIA POV BONSUCESSO
POCO REDONDO,2420112,SAIDA PARA BONSUCESSO,CLINICA DE SAUDE DA FAMILIA ERIONALDO CORREIA PEREIRA
POCO REDONDO,2420139,POVOADO SANTA ROSA DO ERMIRIO,UNIDADE DA FAMILIA EDVANIA GOMES DOS SANTOS
SAO MIGUEL DO ALEIXO,2420171,AVENIDA 26 DE NOVEMBRO,CLINICA DE SAUDE DA FAMILIA MARIA FRANCISCA FERREIRA
SAO MIGUEL DO ALEIXO,2420198,POVOADO LAGOA DOS TAMBURIS,CLINICA DE SAUDE DA FAMILIA MARIA ROSA DE JESUS SANTOS
NOSSA SENHORA DE LOURDES,2420201,RUA 21 DE ABRIL,CLINICA DE SAUDE DA FAMILIA MARIA GOMES DE ANDRADE
NOSSA SENHORA DE LOURDES,2420252,RUA DA QUADRA,SINDICATO DOS TRABALHADORES RURAIS DE N SRA DE LOURDES
POCO VERDE,2420333,POV SACO DO CAMISA,USF POV SACO DO CAMISA
POCO VERDE,2420341,RUA GABRIEL BENEVIDES DO ROSARIO,USF RIO REAL
POCO VERDE,2420376,POV SAO JOSE,USF POV SAO JOSE
POCO VERDE,2420414,POV AMARGOSA,USF DO POV AMARGOSA
TOMAR DO GERU,2420422,POVOADO LOPES,UNIDADE BASICA DE SAUDE PEDRO GOIS
TOMAR DO GERU,2420457,POV CAMPO GRANDE,UNIDADE BASICA DE SAUDE JOAO VELAMES DE OLIVEIRA
SANTA ROSA DE LIMA,2420465,PRACA JACKSON BARRETO,UNIDADE DE SAUDE DA FAMILIA MARIA LUCIA FONTES
LAGARTO,2420511,POVOADO BRASILIA,C S RAIMUNDA REIS
LAGARTO,2420538,AV MACHADO,C S JOSEFA BARBOSA DOS REIS ROMAO
LAGARTO,2420546,POVOADO BREJO,U B S JOSE SERAFIM DOS SANTOS
LAGARTO,2420562,POVOADO MARIQUITA,P S POVOADO MARIQUITA
LAGARTO,2420600,POVOADO LUIZ FREIRE,P S POVOADO LUIZ FREIRE
LAGARTO,2420627,POVOADO ACU VELHO,P S POVOADO ACU VELHO
LAGARTO,2420635,RUA HIPOLITO SANTOS,CENTRO HUMANIZADO DA MULHER E DA CRIANCA
LAGARTO,2420740,POVOADO ACUZINHO,U B S MARGARIDA DO ESPIRITO SANTO
LAGARTO,2420759,POVOADO CARAIBAS,U B S FRANCISCO HORA ALVES
LAGARTO,2420775,POVOADO CAMPO DO CRIOULO,JOSE ANTONIO DE MENEZES MEROBA
LAGARTO,2420791,POVOADO QUILOMBO,P S POVOADO QUILOMBO
LAGARTO,2420805,CIDADE NOVA,U B S JOSE BISPO DE SOUZA
LAGARTO,2420813,PCA ROSENDO RIBEIRO DE SOUZA,SINDICATO TRABALHADORES RURAIS
LAGARTO,2420821,POVOADO OLHOS DAGUA TRAV DO CORREIO,U B S ALCINO CORREIA DOS SANTOS
LAGARTO,2420848,POVOADO PE DA SERRA,U B S PE DA SERRA
RIACHAO DO DANTAS,2420864,POVOADO CARNAIBA,US DA FAMILIA POVOADO CARNAIBA
RIACHAO DO DANTAS,2420872,POVOADO PALMARES,US DA FAMILIA POVOADO PALMARES
RIACHAO DO DANTAS,2420902,POVOADO TANQUE NOVO,US DA FAMILIA POVOADO TANQUE NOVO
RIACHAO DO DANTAS,2420929,POVOADO VIVALDO,US DA FAMILIA POVOADO VIVALDO
CRISTINAPOLIS,2421003,RUA MARIA LUIZA,CLINICA 24H DE SAUDE DA FAMILIA MARIA DANTAS DE CARVALHO
NOSSA SENHORA DA GLORIA,2421011,AVENIDA OESTE,U S F ERIVALDO ALVES OLIVEIRA
NOSSA SENHORA DA GLORIA,2421038,POV LAGOA BONITA,U S F DE LAGOA BONITA
NOSSA SENHORA DA GLORIA,2421046,POV ANGICO,U S F DO ANGICO
NOSSA SENHORA DA GLORIA,2421054,PRACA DO MERCADO,U S F ROSA MARIA DOS SANTOS SOBRINHO
NOSSA SENHORA DA GLORIA,2421062,POVOADO ANINGAS,U S F DE ANINGAS
NOSSA SENHORA DA GLORIA,2421070,POV TANQUE DE PEDRA,U S F DE TANQUE DE PEDRA
NOSSA SENHORA DA GLORIA,2421089,BAIRRO BRASILIA,CLINICA DE SAUDE DA FAMILIA ROSA MARIA DOS SANTOS SOBRINHO
NOSSA SENHORA DA GLORIA,2421097,BAIRRO NOVA ESPERANCA,U S F DE NOVA ESPERANCA
NOSSA SENHORA DA GLORIA,2421100,RUA B,CLINICA DE SAUDE DA FAMILIA SEBASTIAO MONTEIRO DOS SANTOS
NOSSA SENHORA DA GLORIA,2421119,PRACA DO MERCADO,CLINICA DE SAUDE DA FAMILIA MARIA DA CONCEICAO PARTEIRA
NOSSA SENHORA DA GLORIA,2421127,RUA LUIZ JOSE DA SILVA,U S F ANTONIO ARAGAO
NOSSA SENHORA APARECIDA,2421135,RUA WILSOM MENEZES,CLINICA DE SAUDE DA FAMILIA MARIA CLEIDILENE LIMA SANTOS
GARARU,2421178,POVOADO SAO MATEUS,UNIDADE BASICA DE SAUDE DO POVOADO SAO MATEUS
GARARU,2421194,POVOADO OITEIRO,POSTO DE SAUDE OITEIRO
GARARU,2421208,POVOADO PALESTINA,POSTO DE SAUDE POVOADO PALESTINA
GARARU,2421216,POVOADO LAGOA FUNDA,UNIDADE BASICA DE SAUDE POVOADO LAGOA FUNDA
GARARU,2421224,POVOADO LAGOA PRIMEIRA,POSTO DE SAUDE POVOADO LAGOA PRIMEIRA
GARARU,2421232,RUA PROFESSOR BENTO ARAUJO,CLINICA DE SAUDE DA FAMILIA MARIETA ROSA DA SILVA
ITABAIANINHA,2421259,POV DISPENSA,CLINICA DE SAUDE DA FAMILIA BERLANGE RIBEIRO DE GOIS JUNIOR
ITABAIANINHA,2421267,POV ILHA,POSTO SAUDE POV ILHA I
ITABAIANINHA,2421275,POV JARDIM,UNIDADE DE SAUDE DA FAMILIA BERNARDINO NEPOMUCENO
LARANJEIRAS,2421305,POVOADO MUSSUCA,UNIDADE DE SAUDE DA FAMILIA VER JOSE AUGUSTO DOS SANTOS
LARANJEIRAS,2421313,POVOADO BOM JESUS,UNIDADE DE SAUDE DA FAMILIA BOM JESUS
LARANJEIRAS,2421321,RUA NOVA,UNIDADE DE SAUDE DA FAMILIA JOSE ROSA FELIPE
LARANJEIRAS,2421348,RUA SIQUEIRA DE MENEZES,UNIDADE DE SAUDE DA FAMILIA JOSE MUNIZ BARRETO
LARANJEIRAS,2421372,RODOVIA WALTER FRANCO,UNIDADE DE SAUDE DA FAMILIA DR JOSE ARAGAO FIGUEIREDO
UMBAUBA,2421402,RUA BENJAMIN CONSTANT,CLINICA DE S DA FAMILIA DR ERNESTO CHE GUEVARA LYNCH
NOSSA SENHORA DO SOCORRO,2421585,PRACA CANABRAVA,US PREFEITO LUIZ PEREIRA DA SILVA
NOSSA SENHORA DO SOCORRO,2421593,AVENIDA A 3,US VEREADOR GERVASIO REIS DE OLIVEIRA
NOSSA SENHORA DO SOCORRO,2421607,RUA JARDIM,US JOSE DO PRADO FRANCO NETO
NOSSA SENHORA DO SOCORRO,2421615,AV AUXILIAR 2,CLINICA DE SAUDE DA FAMILIA GABRIEL ALVES DA PAIXAO
NOSSA SENHORA DO SOCORRO,2421623,RUA DR MANOEL DOS PASSOS,USEX COMBATENTE 2 TEN WALTER JOSE DE OLIVEIRA SR MANINHO
NOSSA SENHORA DO SOCORRO,2421658,RUA I,US JOSE DO PRADO BARRETO
NOSSA SENHORA DO SOCORRO,2421666,AV L,US TANCREDO NEVES
NOSSA SENHORA DO SOCORRO,2421674,RUA J 1,US DR EDUARDO VITAL DE MELO
NOSSA SENHORA DO SOCORRO,2421682,RUA ALEXANDRE VASCONCELOS,US DR LAURO MAIA
NOSSA SENHORA DO SOCORRO,2421690,AVENIDA 5,US MUGIVAL MESSIAS DOS SANTOS
NOSSA SENHORA DO SOCORRO,2421704,RUA ANTONIO ALVES PINTO,US SANTA CECILIA
NOSSA SENHORA DO SOCORRO,2421712,ZONA RURAL,US WALDEMAR PINTO PEREIRA
NOSSA SENHORA DO SOCORRO,2421720,RUA ESMERALDO DA SILVA SANTOS,US ALCIDES ALVES DOS SANTOS
NOSSA SENHORA DO SOCORRO,2421747,RUA PRINCIPAL,US MUCIANO CABRAL
NOSSA SENHORA DO SOCORRO,2421755,AVENIDA MARIA MINITA,US JOSE ALVES DOS SANTOS
MARUIM,2421763,POVOADO OITEIROS,UNID BASICA DE SAUDE JOEL ALMEIDA TELES
SALGADO,2421801,POVOADO MOENDAS,U S F DO POV MOENDAS
SALGADO,2421860,POVOADO ABOBORA,U S F POV ABOBORA
SALGADO,2421895,POVOADO SAO BENTO,U S F DO POV SAO BENTO
SALGADO,2421909,PRACA DURVAL MILITAO,CASA DE PARTO MARIA DO CARMO N ALVES
TOBIAS BARRETO,2421984,POVOADO CAMPESTRE DO ABREU,11 UNIDADE BASICA DE SAUDE JOSE ALBINO DOS SANTOS
TOBIAS BARRETO,2421992,POVOADO MONTE COELHOS,10 UNIDADE BASICA DE SAUDE JOSELITA OLINDA DOS SANTOS
TOBIAS BARRETO,2422018,POVOADO SAQUINHO,13 UNIDADE BASICA DE SAUDE JOSEFA CATARINA DA SOLIDADE
TOBIAS BARRETO,2422026,POVOADO JABEBERI,12 UNIDADE BASICA DE SAUDE RAIMUNDO SERAFIM DE MENEZES
TOBIAS BARRETO,2422034,RODOVIA GOV ANTONIO CARLOS VALADARES,UNIDADE DE SAUDE DA FAMILIA CONJUNTO IRMA DULCE
TOBIAS BARRETO,2422042,POVOADO SAMAMBAIA,14 UNIDADE BASICA DE SAUDE LAURA MARIA DE JESUS
TOBIAS BARRETO,2422069,RUA ITABAIANINHA,UNIDADE DE SAUDE DA FAMILIA JOAO DE SOUZA ANDRADE
SIRIRI,2422174,RUA DA PAZ,CLINICA DE SAUDE DA FAMILIA SAGRADA FAMILIA
MALHADOR,2422220,AVENIDA SENADOR WALTER FRANCO,UNIDADE DE SAUDE DA FAMILIA PADRE ANTONIO RESENDE DE SOUZA
MALHADOR,2422239,POVOADO PALMEIRAS,UNIDADE DE SAUDE DA FAMILIA POVOADO PALMEIRAS
MALHADOR,2422247,POVOADO ALECRIM,UNIDADE DE SAUDE DA FAMILIA FLORO ALVES DE ARAUJO
SIMAO DIAS,2422271,PRC JOSE BARRETO,CS DR MANOEL AGUIAR
SIMAO DIAS,2422328,POVOADO CURRAL DOS BOIS,UNIDADE DE SAUDE DA FAMILIA DO POVOADO CURRAL DOS BOIS
SIMAO DIAS,2422336,POVOADO SALOBRA,UNIDADE DE SAUDE DA FAMILIA DO POVOADO SALOUBRA
SIMAO DIAS,2422409,POVOADO PAU DE LEITE,USF PEDRO NUNES SILVA POVOADO PAU DE LEITE
SIMAO DIAS,2422433,POVOADO BRINQUINHO,UNIDADE DE SAUDE DA FAMILIA DO POVOADO BRINQUINHO
SIMAO DIAS,2422468,POVOADO TRIUNFO,UNIDADE DE SAUDE DA FAMILIA RAIMUNDO JOSE DE ARAUJO
PROPRIA,2422514,PCA RODRIGUES DORIA,UNIDADE DE SAUDE DA FAMILIA DR CIRO TAVARES
PROPRIA,2422522,RUA DOM JUVENCIO DE BRITTO,UNIDADE DE SAUDE DA FAMILIA DRA VERA FEITOSA
PROPRIA,2422530,POVOADO SAO MIGUEL,UNIDADE DE SAUDE DA FAMILIA DR ELMIR BORGES
PROPRIA,2422549,POVOADO SAO VICENTE,UNIDADE DE SAUDE DA FAMILIA JOSE SOARES DO CARMO
PROPRIA,2422565,AV MINISTRO JOAO ALVES FILHO,UNIDADE DE SAUDE DA FAMILIA DRA MARCIA DANTAS
CUMBE,2422603,RUA ANIZIO CARDOSO,UNIDADE BASICA DE SAUDE M DE GOIS MORAES
CUMBE,2422638,POVOADO FORTE,UNIDADE BASICA DE SAUDE MARIA GENOLE DE MOURA
AQUIDABA,2422646,POVOADO CRUZ GRANDE,USF CRUZ GRANDE
AQUIDABA,2422654,RODOVIA GOVERNADOR VALADARES,USF MARIA HILDA FERREIRA
AQUIDABA,2422662,POVOADO SACO DE AREIA,USF SACO DE AREIA
AQUIDABA,2422670,RUA DA CERAMICA,USF MARTA BARRETO
AQUIDABA,2422689,AVENIDA GETULIO VARGAS,USF GETULIO VARGAS
AQUIDABA,2422697,RUA GENERAL ADEMAR MESSIAS ARAGAO,CENTRO DE SAUDE DE AQUIDABA
AQUIDABA,2422778,POVOADO MOITA REDONDA,USF MARIA IVANETE FERREIRA DONA VANDA
ITAPORANGA D'AJUDA,2422794,POVOADO TAPERA,USF TAPERA
ITAPORANGA D'AJUDA,2422824,POVOADO NOVA DESCOBERTA,USF DO POVOADO NOVA DESCOBERTA
ITAPORANGA D'AJUDA,2422832,POVOADO SAPE,USF SAPE
ITAPORANGA D'AJUDA,2422840,POVOADO GRAVATA,USF GRAVATA
ITAPORANGA D'AJUDA,2422859,POVOADO CAUEIRA,USF CAUEIRA
ESTANCIA,2422905,TV CAMILO CALAZANS,CENTRO DE REFERENCIA MIN LEONOR B FRANCO
DIVINA PASTORA,2423006,AV ADELIA FRANCO,CLINICA DE SAUDE DA FAMILIA DR MARCELO VILLAS BOAS
DIVINA PASTORA,2423014,RUA PRINCIPAL,UNIDADE BASICA DE SAUDE DR RAUL ROLLEMBERG
INDIAROBA,2423111,POVOADO COLONIA RETIRO,UNIDADE DE SAUDE DA FAMILIA COLONIA RETIRO
ARAUA,2423170,PRACA PROFESSORA ADIVA,CLINICA DE SAUDE DA FAMILIA LUZIA NASCIMENTO SILVA
ROSARIO DO CATETE,2423189,RUA ANTONIO DIAS PINA,CLINICA DE SAUDE DA FAMILIA GOV EDELZIO VIEIRA DE MELO
SAO CRISTOVAO,2423200,AV MARGINAL SN,U B S MARIA JOSE S FIGUEIROA
SAO CRISTOVAO,2423219,RUA HORACIO DE SOUZA LIMA,U S F MASOUD JALALI
SAO CRISTOVAO,2423227,AVENIDA FELIX PEREIRA,U B S JAIRO TEIXEIRA DE JESUS
SAO CRISTOVAO,2423243,RUA PRINCIPAL,U S MARIA DE LOURDES CRUZ RITA CACETE
SAO CRISTOVAO,2423251,POVOADO CABRITA,USF MARIA LUIZA DOS SANTOS NASCIMENTO
SAO CRISTOVAO,2423278,POVOADO PEDREIRAS,U S F ALICE FREIRE PEDREIRAS
SAO CRISTOVAO,2423286,POVOADO CARDOSO,U S F MANOEL JUVINO SANTOS CARDOSO
SAO CRISTOVAO,2423294,PRACA PRINCIPAL,U S F JOSE A DE LIMA C MIRANDA
MALHADA DOS BOIS,2423324,RUA GOVERNADOR VALADARES,UBS MARIA LEONIDIA DOS SANTOS
SAO FRANCISCO,2423359,RUA MARIA JOCELINA VIEIRA DE ARAUJO,CENTRO DE SAUDE DA FAMILIA DE SAO FRANCISCO
SANTO AMARO DAS BROTAS,2423456,RUA IRMA ELVIRA DELVECCHIO,USF DE SANTO AMARO
FREI PAULO,2423634,RUA DA TELERGIPE,POSTO DE SAUDE DE ALAGADICO
GENERAL MAYNARD,2420325,PRACA DA MATRIZ,UNIDADE BASICA DE SAUDE JOSEFINA CARDOSO DA SILVA
CAPELA,2476940,POVOADO PIRUNGA,UNIDADE DE SAUDE DA FAMILIA LUCAS LOPES MOTA
CAPELA,2476959,AV QUINTINO BOCAIUVA,CLINICA DE SAUDE DA FAMILIA DR GERALDO LUIZ SOUZA MOTA
PIRAMBU,2477149,RUA GONCALO ROLLBERG,EQUIPE BASICA DE SAUDE SAGRADO CORACAO DE JESUS
FEIRA NOVA,2477173,RODOVIA ENGENHEIRO JORGE NETO,CLINICA DE S F MARIA ROSA DOS SANTOS
ILHA DAS FLORES,2477181,PRACA SAO ROQUE,CSF LUIZ FERREIRA LISBOA
MURIBECA,2477262,RUA LUIZ MOTA,CLINICA SAUDE DA FAMILIA MARILZA FRANCO
MURIBECA,2477270,RUA MANOEL ROSENDO,UNIDADE BASICA DE SAUDE SACO DAS VARAS
MURIBECA,2477297,RUA MARIA OLIVEIRA VIEIRA,UNIDADE BASICA DE SAUDE VISGUEIRO
MACAMBIRA,2477300,RUA ROQUE BISPO DE MENEZES,CLINICA DE SAUDE RAIMUNDA RIBEIRO DOS SANTOS DONA CACULA
MACAMBIRA,2477335,POVOADO LAGOA SECA,UNIDADE DE SAUDE DA FAMILIA JOAO CALAZANS DE ALMEIDA
PEDRA MOLE,2477548,POVOADO GRAVATA,UBS MARIA JOSE SOARES FIGUEIROA
PEDRA MOLE,2477556,POVOADO TAPADO,UBS JOSE MACHADO DE SOUZA
PEDRA MOLE,2477564,POVOADO MANUINO,UBS JOVITA MARIA DE ALMEIDA
PEDRA MOLE,2477572,PRACA DOS ESTUDANTES,CLINICA JOSE FONSECA DA CONCEICAO
BARRA DOS COQUEIROS,2477580,RUA A,CLINICA DE SAUDE DA FAMILIA SANTA LUZIA
BARRA DOS COQUEIROS,2477602,RUA SENADOR POMPEU,UNIDADE DE SAUDE DA FAMILIA PREFEITO AURELIANO RODRIGUES
BARRA DOS COQUEIROS,2477610,RUA O,UNIDADE DE SAUDE DA FAMILIA GILSON SANTOS
JAPOATA,2477637,RUA DR JOAO AUGUSTO FALCAO,CLINICA DE SAUDE DA FAMILIA DOURIVAL DIAS GUIMARAES
JAPOATA,2477645,POVOADO POXIM,UNIDADE DE SAUDE DA FAMILIA OZEIAS ALVES DOS SANTOS
JAPOATA,2477653,POV ESPINHEIRO RUA JOSE V BRANDAO,UNIDADE DE SAUDE DA FAMILIA DE ESPINHEIRO
ITABAIANA,2477688,RUA JOSUE PASSOS,CLINICA DE SAUDE DA FAMILIA VEREADOR VIVALDO MENEZES
ITABAIANA,2477726,POVOADO CAJAIBA,UNIDADE PSF CAJAIBA
ITABAIANA,2477734,RUA FRANCISCO BRAGANCA,UNIDADE PSF DR LUCIANO SIQUEIRA
ITABAIANA,2477742,POVOADO LAGOA DO FORNO,UNIDADE PSF JOSE CARLOS JESUS SILVEIRA LAGOA DO FORNO
ITABAIANA,2477750,RUA ARGENTINA,UNIDADE PSF MUTIRAO
ITABAIANA,2477769,POVOADO RIO DAS PEDRAS,UNIDADE PSF RIO DAS PEDRAS
ITABAIANA,2477777,RUA PRINCIPAL,CLINICA DE SAUDE DA FAMILIA MANOEL PEREIRA DE ANDRADE
ESTANCIA,2477807,RUA MARIA HELENA SILVA FRANCA FROES,USF DR IVALDO DE LIMA GAIAO
ESTANCIA,2477823,COLONIA ENTRE RIOS,USF WALDEMAR RODRIGUES DE ALMEIDA
ESTANCIA,2477858,AV RAIMUNDO SILVEIRA SOUZA,USF IRMA MADALENA
ESTANCIA,2477866,AV CAMILO CALAZANS CJ PAULO AMARAL,USF ENFERMEIRO LUIZ CARLOS PAIXAO DO NASCIMENTO
ESTANCIA,2477882,POVOADO ABAIS,POSTO DE SAUDE MARIA EUNICE DOS SANTOS
ESTANCIA,2477890,AVENIDA MANOEL BONFIM,USF DR JOSE AUGUSTO NASCIMENTO
ESTANCIA,2477904,JOAO BARRETO DO NASCIMENTO,USF RAIMUNDA MESQUITA
ESTANCIA,2477912,RUA SANTA LUZIA,USF JULIO DOS SANTOS
NEOPOLIS,2477920,RUA DO JASMIN,E S F PINDOBA
NEOPOLIS,2477939,MUSSUIPE,E S F MUSSUIPE
NOSSA SENHORA DO SOCORRO,2497158,AV A 28,US HEITOR DIAS SOARES
NOSSA SENHORA DO SOCORRO,2502801,RUA A,MORADIA REAPRENDENDO A VIVER
ITABAIANA,2502860,RUA PERCILIO ANDRADE,CTA DE ITABAIANA SE
ILHA DAS FLORES,2502895,POVOADO SERRAO,USF POV SERRAO
BARRA DOS COQUEIROS,2502917,POVOADO JATOBA,UNIDADE DE SAUDE DA FAMILIA SR GILENO DE JESUS
CARIRA,2502925,POVOADO DESCOBERTO,USF POV DESCOBERTO
LAGARTO,2503794,POVOADO PURURUCA,U B S PEDRO FELIX DOS SANTOS
LAGARTO,2503808,BAIRRO EXPOSICAO,CLINICA DE SAUDE DA FAMILIA JOSE ANTONIO MAROTO
RIACHUELO,2545799,RUA SANTA MARIA,CENTRO DE SAUDE DR PAULO GARCEZ
RIACHUELO,2545802,AV OSSIRES DE ABREU SILVEIRA,UNIDADE DE SAUDE DA FAMILIA DR CLEOVANSOSTENES P DE AGUIAR
RIACHUELO,2545810,POVOADO CENTRAL,UNIDADE DE SAUDE DA FAMILIA DO POVOADO CENTRAL
SALGADO,2545888,POVOADO,U S F DO POV AGUA FRIA
PACATUBA,2546035,POV PONTA DE AREIA,UNIDADE BASICA DE SAUDE MARIA JOSE DE FRANCA
PACATUBA,2546051,RUA A CONJUNTO ALBANO FRANCO,CSF MARIA DO CEU INACIO DA SILVA
SIMAO DIAS,2546108,POVOADO SITIO ALTO COMUNIDADE QUILOMBOLA,UNIDADE DE SAUDE DA FAMILIA ASSENTADOS E QUILOMBOLAS
ITABAIANA,2546140,POVOADO MATAPOA,UNIDADE BASICA DE SAUDE DEP DJALMA LOBO
ITABAIANA,2546167,POVOADO QUEIMADAS,UNIDADE PSF QUEIMADAS
CARIRA,2546256,POVOADO BAIXA GRANDE,USF BAIXA GRANDE
CARIRA,2546264,PRACA JOSE DURVAL DE MATOS,USF ALDA NUNES CHAGAS
PINHAO,2546280,POV RAJAS,UNIDADE BASICA DONA CACULA
MARUIM,2546302,POV PAU FERRO,UNID BASICA DE SAUDE N SRA DA CONCEICAO
MARUIM,2546310,RUA LACHEZ DE BAIXO,UNID BASICA DE SAUDE JOAO VIEIRA DOS SANTOS
MARUIM,2546329,RUA ALVARO GARCEZ,UNID BASICA DE SAUDE GENIVAL PEREIRA DOS SANTOS
MARUIM,2546337,RUA MAJOR MIGUEL,UNID BASICA DE SAUDE SAO JOSE
NOSSA SENHORA DO SOCORRO,2421739,RUA 55,US GILTON REZENDE
ARACAJU,2600366,RUA H 5,US AUGUSTO FRANCO
ITABAIANA,2611872,POVOADO PE DO VEADO,UNIDADE PSF PE DO VEADO
ITABAIANA,2611899,RUA SAO JOSE,UNIDADE PSF VLADEMIR SOUZA DE CARVALHO
ITABAIANA,2611929,POVOADO SERRA,UNIDADE PSF SERRA PROF DEUZINHA TAVARES DOS SANTOS
GRACHO CARDOSO,2612216,RUA DA MATERNIDADE,FUNDACAO NACIONAL DE SAUDE
GRACHO CARDOSO,2612224,RUA DA GLORIA,CLINICA DE SAUDE DA FAMILIA NOSSA SENHORA DA PIEDADE
NOSSA SENHORA DAS DORES,2612259,POVOADO BORDA DA MATA,UNIDADE DE SAUDE DA FAMILIA DR JAI CARVALHO
ILHA DAS FLORES,2612291,POVOADO BOLIVAR,USF POV BOLIVA
MURIBECA,2612305,POVOADO CAMARA,UNIDADE BASICA DE SAUDE CAMARA
SAO CRISTOVAO,2612356,AV HORACIO SOUZA LIMA,U S F DR JOSE RAIMUNDO ARAGAO
NOSSA SENHORA DAS DORES,2658399,POVOADO GADO BRAVO SUL,POSTO DE SAUDE MARIA DALVA RODRIGUES SOBRAL
BREJO GRANDE,2658410,PRACA MARECHAL DEODORO,CLINICA DE SAUDE DA FAMILIA MARECHAL DEODORO DA FONSECA
BREJO GRANDE,2658429,POVOADO BREJAO,UNIDADE DE SAUDE DA FAMILIA JADER PEREIRA DE FARIAS
CAMPO DO BRITO,4020685,POVOADO TERRA VERMELHA,POSTO DE SAUDE EPIFANEO JOSE DE ANDRADE
CEDRO DE SAO JOAO,2658593,PRACA JONAS TRINDADE,CLINICA DE SAUDE DA FAMILIA JURACI RAMOS ROCHA
CEDRO DE SAO JOAO,2658607,AVENIDA DOUTOR VALDIR FREITAS DANTAS,UNIDADE DE SAUDE DA FAMILIA MARIA MESSIAS DE ANDRADE
NEOPOLIS,2658615,RUA LUIZ GONZAGA MACHADO BARRETO,E S F PERIFERIA
PROPRIA,2658623,RUA SERAPIAO DE AGUIAR,CENTRO GINECOLOGICO DRA LEONOR BARRETO FRANCO
NOSSA SENHORA DAS DORES,2658658,POVOADO SUCUPIRA,UNIDADE BASICA DE SAUDE JOSE ROLEMBERG LEITE
CAMPO DO BRITO,4020707,POVOADO GARANGAU,POSTO DE SAUDE ROQUE JOSE DE SOUZA
CAMPO DO BRITO,4020715,POVOADO GAMELEIRA,UNIDADE BASICA DE SAUDE ANTONIO VITOR
CANHOBA,2680076,AV GOV ERONILDES F DE CARVALHO,PS APARECIDA GUIMARAES
CEDRO DE SAO JOAO,2680084,POVOADO POCO DOS BOIS,UNIDADE DE SAUDE DA FAMILIA POCO DOS BOIS
NEOPOLIS,2680092,RUA DO BONFIM,E S F CENTRO I
LAGARTO,2680122,CONJ ALBANO FRANCO RUA JOSE MARIA DE ALMEIDA,CLINICA DE SAUDE DA FAMILIA DR DAVI MARCOS DE LIMA
LAGARTO,2680130,POVOADO PINDOBA,P S PROFESSOR ALMEIDA
CAMPO DO BRITO,4020731,RUA RODRIGUES DOREA,CLINICA DE SAUDE DA FAMILIA NOSSA SENHORA DA BOA HORA
CARMOPOLIS,2745232,RUA GETULIO VARGAS,COORDENADORIA DE VIGILANCIA SANITARIA
MARUIM,2745275,RUA ALCEBIADES VIEIRA DANTAS,UNID BASICA DE SAUDE SANTO ANTONIO
JAPOATA,2745291,POV PROJETO LADEIRINHAS A,UNIDADE DE SAUDE DA FAMILIA JOSE RODRIGUES DOS SANTOS
TOMAR DO GERU,2420449,RUA NOVA ESPERENCA,CLINICA SAUDE DA FAMILIA MARCELO SOARES DA FONSECA
ITAPORANGA D'AJUDA,2815877,POVOADO SALVADOR,USF DO POVOADO SALVADOR
ITABAIANINHA,3000346,POVOADO PATU,UBS ELVIRA FRANCISCA DE JESUS POVOADO PATU
ITABAIANINHA,3010732,RUA JOSE MARIA COSTA,CENTRO DE SAUDE JOSE NAILSON MOURA
ITABAIANINHA,3010740,POVOADO POXICA,CLINICA DE SAUDE DA FAMILIA HORMINIO DE FREITAS LIMA
NOSSA SENHORA APARECIDA,3012247,POVOADO ITACOATIARA,POSTO DE SAUDE DO POV ITACOATIARA
NOSSA SENHORA APARECIDA,3012255,POVOADO CRUZ DAS GRACAS,UNIDADE DE SAUDE DA FAMILIA
NOSSA SENHORA DO SOCORRO,3018938,AV PRINCIPAL,US OTAVIANA MATOS
NOSSA SENHORA DO SOCORRO,3018954,RUA A,US ANTONIO CARLOS LEITE FRANCO
LAGARTO,3036537,BAIRRO JARDIM CAMPO NOVO,U B S BAIRRO JARDIM CAMPO NOVO
JAPOATA,3047628,POVOADO LADEIRAS,UNIDADE DE SAUDE DA FAMILIA MANOEL CALDAS DE SIQUEIRA
LAGARTO,3048039,ALTO DA BOA VISTA,U B S ALTO DA BOA VISTA
LARANJEIRAS,3048160,RUA G,UNIDADE DE SAUDE DA FAMILIA VER NICANOR SOUZA
NOSSA SENHORA DO SOCORRO,3060101,AV PERIMETRAL,CLINICA DE SAUDE DA FAMILIA AUGUSTO CESAR LEITE FRANCO
BARRA DOS COQUEIROS,3074684,RUA GILBERTO GIL,VER ANA DOS ANJOS SANTOS
ITAPORANGA D'AJUDA,2422816,AVENIDA EMIDIO MAXI NETO,CLINICA DE SAUDE DA FAMILIA UMBERTO MANDARINO
ARACAJU,3210634,AV AYRTON SENNA,US ANALIA PINA DE ASSIS ALM TAMANDARE
ITABAIANA,3277232,AV PADRE AILTON G LIMA,RESIDENCIA TERAPEUTICA MORADA DA SERRA
ITABAIANA,3281329,RUA PERCILIO ANDRADE,UNIDADE PSF DR LAURO MAIA
ITABAIANINHA,3292835,CONJUNTO LEONOR BARRETO FRANCO RUA A,UNIDADE DE SAUDE DA FAMILIA CARLOS ROBERTO CARVALHO SILVA
NOSSA SENHORA DO SOCORRO,3307697,LOT N SRA DE FATIMA,US PARQUE NOSSA SENHORA DE FATIMA
ITABAIANINHA,3323161,TRAVESSA FRANCISCO SEVERO,CLINICA DE SAUDE DA FAMILIA MARIA FRANCISCA DE SANTANA
LARANJEIRAS,3335690,ALAMEDA IEDA ROSA,UNIDADE DE SAUDE DA FAMILIA ANTONIO MENEZES LEITE
ARACAJU,3469182,AV GUANABARA,US JOALDO BARBOSA
NOSSA SENHORA DO SOCORRO,3496171,AVENIDA L,US JOSAFA MOTA DE SOUZA
POCO VERDE,3510018,RUA GABRIEL BENEVIDES DO ROSARIO,USF FAZENDINHA
NOSSA SENHORA DA GLORIA,3515893,RODOVIA ENGENHEIRO JORGE NETO,RESIDENCIAL TERAPEUTICO MADRE ALBERTINA BRASIL
SAO CRISTOVAO,3519740,RUA SAO LOURENCO,U S F ANTONIO FLORENCIO DE MATOS
PACATUBA,3519805,PONTA DOS MANGUES,UNIDADE BASICA DE SAUDE DE PONTA DOS MANGUES
BOQUIM,2545985,POVOADO FLORESTA,USF UNIDADE DE SAUDE DA FAMILIA RIVALDO BATISTA SANTOS
TOBIAS BARRETO,3555585,RUA JOSE ROSA DE OLIVEIRA,UNIDADE DE SAUDE DA FAMILIA CONJ MARIA DO CARMO
SAO FRANCISCO,3605671,POVOADO PICARREIRA,CENTRO DE SAUDE DA FAMILIA DO POVOADO PICARREIRA
PROPRIA,3619958,CONJ MARIA DO CARMO,UNIDADE DE SAUDE DA FAMILIA JOSE RENATO VIEIRA BRANDAO
RIACHUELO,3732010,POVOADO BELA VISTA,UNIDADE DE SAUDE DA FAMILIA DO POVOADO BELA VISTA
NOSSA SENHORA DO SOCORRO,3830667,RUA A,MORADIA REAPRENDENDO A VIVER 02
NOSSA SENHORA DO SOCORRO,3830705,RUA A,MORADIA REAPRENDENDO A VIVER 03
NOSSA SENHORA DO SOCORRO,3830772,RUA A,MORADIA REAPRENDENDO A VIVER 04
NOSSA SENHORA DO SOCORRO,3830799,RUA A,MORADIA REAPRENDENDO A VIVER 01
NOSSA SENHORA DO SOCORRO,3830829,ANTONIO VALADAO,NOVO LAR
NOSSA SENHORA DO SOCORRO,3830861,62 65,VIDA NOVA
